{
  "$schema": ".requirement-manifest.schema.json",
  "version": "1.0",
  "projectName": "Vibe Project",
  "requirements": [
    {
      "id": "REQ-1774628144",
      "name": "Review follow-up: align slash commands with actual skill invocations",
      "description": "Source: code-review. Severity: MEDIUM. Evidence: New skill docs advertise additional slash commands (/debug-repro, /debug-root-cause, /debug-validate, /manual-audit, /manual-changelog, /code-review-req, /code-review-create-threads) that are not implemented as standalone prompts/skills, which can mislead users. Required outcome: either implement these commands as actual prompts/agents or reword docs to describe them as workflow phases under /bug-fix, /update-manual, and /code-review.",
      "status": "DEPLOYED",
      "priority": "MEDIUM",
      "createdAt": "2026-03-27T16:15:44Z",
      "updatedAt": "2026-03-28T00:20:00Z",
      "worktreeId": "feature/REQ-1774628144-review-follow-up-align-slash-commands-with-actual-skill-invocations",
      "deployedAt": "2026-03-28T00:20:00Z",
      "origin": "vibe-master"
    },
    {
      "id": "REQ-1774630000",
      "name": "Update README for Vibe Master upgrade migration",
      "description": "Update README so agents and users understand how to upgrade Vibe Master in an existing project that was built with an older Vibe Master version.",
      "status": "DEPLOYED",
      "priority": "MEDIUM",
      "createdAt": "2026-03-28T00:30:00Z",
      "updatedAt": "2026-04-09T07:07:23Z",
      "worktreeId": "feature/REQ-1774630000-update-readme-for-vibe-master-upgrade-migration",
      "origin": "vibe-master",
      "deployedAt": "2026-04-09T07:07:23Z"
    },
    {
      "id": "REQ-1774632175",
      "name": "Review follow-up: polish upgrade guide in README",
      "description": "Source: code-review of REQ-1774630000. Severity: LOW. Evidence: (1) Step 3 of the upgrade workflow tells users to place template files but gives no concrete command to fetch/clone them — users won't know how to obtain the latest template. (2) Step 1 creates a branch via checkout -b that is never used because Step 2 immediately creates a worktree with a different branch name. Required outcome: add a concrete fetch/clone example in Step 3, and simplify Step 1 to only create the safety tag (drop the unused branch).",
      "status": "DEPLOYED",
      "priority": "LOW",
      "createdAt": "2026-03-27T17:22:55Z",
      "updatedAt": "2026-04-09T07:07:23Z",
      "worktreeId": "feature/REQ-1774632175-review-follow-up-polish-upgrade-guide-in-readme",
      "origin": "vibe-master",
      "deployedAt": "2026-04-09T07:07:23Z"
    },
    {
      "id": "REQ-1774636689",
      "name": "Auto-create REQ from bug-fix when new feature needed",
      "description": "During a /bug-fix session, if the bug fix requires implementing a new function or feature of the vibe project to complete, the debug skill should automatically create a new REQ to track that work and link it as a dependency.",
      "status": "DEPLOYED",
      "priority": "MEDIUM",
      "createdAt": "2026-03-27T18:38:09Z",
      "updatedAt": "2026-03-27T18:47:35Z",
      "worktreeId": "feature/REQ-1774636689-auto-create-req-from-bug-fix-when-new-feature-needed",
      "origin": "vibe-master"
    },
    {
      "id": "REQ-1774639240",
      "name": "Add-requirement: populate spec sections after creation",
      "description": "Source: code-review. Severity: HIGH. Evidence: add-requirement.prompt.md defines 5 workflow steps but none instruct the agent to populate spec file sections. create-requirement.sh writes static placeholders for Success Criteria, Technical Notes, Dependencies, and Worktree. Required outcome: add a prompt workflow step to derive success criteria, generate technical notes, link dependencies, and populate the manifest notes field after the script creates the spec file.",
      "notes": "Fix is a prompt workflow change in add-requirement.prompt.md — add step 4 to enrich the spec file post-creation. Shell script stays as-is (scaffolding only).",
      "status": "DEPLOYED",
      "priority": "HIGH",
      "createdAt": "2026-03-27T19:20:40Z",
      "updatedAt": "2026-04-09T07:07:23Z",
      "worktreeId": "feature/REQ-1774639240-add-requirement-populate-spec-sections-after-creation",
      "origin": "vibe-master",
      "deployedAt": "2026-04-09T07:07:23Z"
    },
    {
      "id": "REQ-1774681642",
      "name": "execution standard on working with a requirement",
      "description": "the vibe master agent should come up with a development plan after reading the requirement, and append to according REQ file, so that whenever it comes back to the requirement, it can know where to start and what to work on",
      "notes": "Persist a structured Development Plan section in each REQ spec so work can resume deterministically on revisit.",
      "status": "DEPLOYED",
      "priority": "MEDIUM",
      "createdAt": "2026-03-28T07:07:22Z",
      "updatedAt": "2026-04-09T07:07:23Z",
      "worktreeId": "feature/REQ-1774681642-execution-standard-on-working-with-a-requirement",
      "origin": "vibe-master",
      "deployedAt": "2026-04-09T07:07:23Z"
    },
    {
      "id": "REQ-1774685792",
      "name": "upgrade functions referring to obra's superpower agent",
      "description": "read the repo https://github.com/obra/superpowers and suggest what functions can be referred to upgrade vibe master, yet not changing current workflow and standards significantly",
      "status": "DEPLOYED",
      "priority": "MEDIUM",
      "createdAt": "2026-03-28T08:16:32Z",
      "updatedAt": "2026-04-09T07:07:23Z",
      "notes": "Research superpowers skills (brainstorming, writing-plans, using-git-worktrees, systematic-debugging) for minimal-alignment upgrades to Vibe skills and prompts.",
      "worktreeId": "feature/REQ-1774685792-upgrade-functions-referring-to-obra-s-superpower-agent",
      "origin": "vibe-master",
      "deployedAt": "2026-04-09T07:07:23Z"
    },
    {
      "id": "REQ-1774770291",
      "name": "Review follow-up: fix generate-plan.sh triple bug",
      "description": "Source: code-review. Severity: HIGH. Evidence: (1) heredoc uses single-quoted EOF so variables are not expanded — plan text contains literal dollar-sign references instead of actual values. (2) awk system() calls reference unexported PLAN_FILE shell variable which is invisible to the subshell. (3) plan content is hardcoded to superpowers-research steps from REQ-1774685792 and is irrelevant for all other requirements. Required outcome: rewrite generate-plan.sh so it produces requirement-specific scaffolding with proper variable expansion, or remove the script and rely on the agent prompt workflow exclusively.",
      "status": "DEPLOYED",
      "priority": "HIGH",
      "createdAt": "2026-03-29T07:44:51Z",
      "updatedAt": "2026-04-09T07:07:23Z",
      "worktreeId": "feature/REQ-1774770291-review-follow-up-fix-generate-plan-sh-triple-bug",
      "origin": "vibe-master",
      "deployedAt": "2026-04-09T07:07:23Z"
    },
    {
      "id": "REQ-1774770298",
      "name": "Review follow-up: separate manifest schema from data",
      "description": "Source: code-review. Severity: HIGH. Evidence: .requirement-manifest.json and .worktree-manifest.json both embed JSON Schema keywords (properties, type, title, description) alongside actual data arrays at the same level. This fails JSON Schema validation and causes semantic ambiguity with the required keyword. Required outcome: move schema definitions to separate .schema.json files referenced by a top-level dollar-schema key, keeping manifests as pure data files.",
      "status": "DEPLOYED",
      "priority": "HIGH",
      "createdAt": "2026-03-29T07:44:58Z",
      "updatedAt": "2026-04-09T07:07:23Z",
      "origin": "vibe-master",
      "deployedAt": "2026-04-09T07:07:23Z"
    },
    {
      "id": "REQ-1774770305",
      "name": "Review follow-up: add missing prompt files for advertised slash commands",
      "description": "Source: code-review. Severity: HIGH. Evidence: copilot-instructions.md lists /worktree-create and /worktree-prune as available slash commands, and worktree-manager/SKILL.md advertises /worktree-status, but no corresponding .prompt.md files exist. REQ-1774628144 (DEPLOYED) was supposed to align commands but missed these three. Required outcome: either create worktree-create.prompt.md, worktree-prune.prompt.md, and worktree-status.prompt.md, or remove these commands from copilot-instructions.md and SKILL.md.",
      "status": "DEPLOYED",
      "priority": "HIGH",
      "createdAt": "2026-03-29T07:45:05Z",
      "updatedAt": "2026-04-09T07:07:23Z",
      "origin": "vibe-master",
      "deployedAt": "2026-04-09T07:07:23Z"
    },
    {
      "id": "REQ-1774770314",
      "name": "Review follow-up: fix SKILL.md jq injection examples and stale status values",
      "description": "Source: code-review. Severity: MEDIUM. Evidence: (1) requirement-tracker/SKILL.md and worktree-manager/SKILL.md use direct shell variable interpolation in jq programs instead of --arg, creating injection risk in documentation examples. (2) requirement-tracker/SKILL.md lists REVERTED as a valid transition target but REVERTED is not in the manifest schema enum or update-requirement-status.sh. Required outcome: update all SKILL.md jq examples to use --arg parameterization and replace REVERTED with CANCELLED.",
      "status": "DEPLOYED",
      "priority": "MEDIUM",
      "createdAt": "2026-03-29T07:45:14Z",
      "updatedAt": "2026-04-09T07:07:23Z",
      "worktreeId": "feature/REQ-1774770314-review-follow-up-fix-skill-md-jq-injection-examples-and-stale-status-values",
      "origin": "vibe-master",
      "deployedAt": "2026-04-09T07:07:23Z"
    },
    {
      "id": "REQ-1774770322",
      "name": "Review follow-up: unify slug generation and fix init-project gaps",